{
  "version": "1",
  "request_id": "feature-route-1",
  "role": "feature",
  "status": "selected",
  "requested": {
    "budget": "unlimited",
    "reasoning_tier": "very-high",
    "capabilities": ["code-implementation"],
    "seat_count": 1,
    "diversity": "none"
  },
  "realized": [
    {
      "seat": 1,
      "candidate_id": "candidate-code",
      "reasoning_tier": "very-high",
      "independence_group": "group-a",
      "selection_source": "catalog"
    }
  ],
  "fallbacks": []
}
