{
  "version": "1",
  "request_id": "arena-cross-judge-1",
  "role": "arena-cross-judge",
  "status": "selected",
  "requested": {
    "budget": "unlimited",
    "reasoning_tier": "maximum",
    "capabilities": ["comparative-judgment"],
    "seat_count": 1,
    "diversity": "prefer-different-from-parent"
  },
  "realized": [
    {
      "seat": 1,
      "candidate_id": "candidate-judgment",
      "reasoning_tier": "maximum",
      "independence_group": "group-b",
      "selection_source": "catalog"
    }
  ],
  "fallbacks": []
}
